{
  "schema_version": "1.0.0",
  "plan_path": "plans/<task>-plan.md",
  "goal": "<USER-FACING GOAL>",
  "complexity_tier": "SMALL",
  "phases": [
    {
      "id": "1",
      "objective": "Capture current behavior, then simplify one selected structure.",
      "dependencies": [],
      "files": ["<VERIFIED FILE>"],
      "commands": ["<EXACT COMMAND>"],
      "success_criteria": ["Characterization and full contract tests preserve behavior."]
    }
  ],
  "semantic_risks": [
    {"category": "data_volume", "applicability": "not_applicable", "impact": "LOW"},
    {"category": "performance", "applicability": "applicable", "impact": "LOW"},
    {"category": "concurrency", "applicability": "not_applicable", "impact": "LOW"},
    {"category": "access_control", "applicability": "not_applicable", "impact": "LOW"},
    {"category": "migration_rollback", "applicability": "not_applicable", "impact": "LOW"},
    {"category": "dependency", "applicability": "not_applicable", "impact": "LOW"},
    {"category": "operability", "applicability": "applicable", "impact": "MEDIUM"}
  ],
  "success_criteria": ["Characterization and full contract tests preserve behavior."]
}
