{
  "schema_version": "1.0.0",
  "plan_path": "plans/<task>-plan.md",
  "goal": "<USER-FACING GOAL>",
  "complexity_tier": "MEDIUM",
  "phases": [
    {
      "id": "1",
      "objective": "Define compatibility and recovery before the migration.",
      "dependencies": [],
      "files": ["<VERIFIED FILE>"],
      "commands": ["<EXACT COMMAND>"],
      "success_criteria": ["Validation proves the compatible path and rollback or recovery."]
    }
  ],
  "semantic_risks": [
    {"category": "data_volume", "applicability": "applicable", "impact": "MEDIUM"},
    {"category": "performance", "applicability": "applicable", "impact": "MEDIUM"},
    {"category": "concurrency", "applicability": "applicable", "impact": "MEDIUM"},
    {"category": "access_control", "applicability": "applicable", "impact": "MEDIUM"},
    {"category": "migration_rollback", "applicability": "applicable", "impact": "MEDIUM"},
    {"category": "dependency", "applicability": "applicable", "impact": "LOW"},
    {"category": "operability", "applicability": "applicable", "impact": "HIGH"}
  ],
  "success_criteria": ["Validation proves the compatible path and rollback or recovery."]
}
