{
  "schema_version": "1.0.0",
  "plan_path": "plans/examples/docs-test-only-plan.md",
  "goal": "Document the metadata sidecar and verify the public contract without changing runtime behavior.",
  "complexity_tier": "SMALL",
  "phases": [{"id": "1", "objective": "Add concise public documentation and a stable assertion for its key phrase.", "dependencies": [], "files": ["README.md", "tests/controlflow-skill-contract.tests.ps1"], "commands": ["powershell -ExecutionPolicy Bypass -File tests\\controlflow-skill-contract.tests.ps1"], "success_criteria": ["Documentation and its contract assertion agree on the sidecar behavior."]}],
  "semantic_risks": [
    {"category": "data_volume", "applicability": "not_applicable", "impact": "LOW"},
    {"category": "performance", "applicability": "not_applicable", "impact": "LOW"},
    {"category": "concurrency", "applicability": "not_applicable", "impact": "LOW"},
    {"category": "access_control", "applicability": "not_applicable", "impact": "LOW"},
    {"category": "migration_rollback", "applicability": "not_applicable", "impact": "LOW"},
    {"category": "dependency", "applicability": "not_applicable", "impact": "LOW"},
    {"category": "operability", "applicability": "applicable", "impact": "LOW"}
  ],
  "success_criteria": ["Documentation and its contract assertion agree on the sidecar behavior."]
}
