{
  "schema_version": "1.0.0",
  "plan_path": "plans/examples/bugfix-plan.md",
  "goal": "Reject a validator input that references an unknown phase dependency.",
  "complexity_tier": "SMALL",
  "phases": [{"id": "1", "objective": "Prove the validator rejects the unknown dependency and preserve valid inputs.", "dependencies": [], "files": ["scripts/validate-plan.ps1", "tests/validate-plan.tests.ps1"], "commands": ["powershell -ExecutionPolicy Bypass -File tests\\validate-plan.tests.ps1"], "success_criteria": ["Unknown metadata phase dependencies fail deterministically."]}],
  "semantic_risks": [
    {"category": "data_volume", "applicability": "not_applicable", "impact": "LOW"},
    {"category": "performance", "applicability": "not_applicable", "impact": "LOW"},
    {"category": "concurrency", "applicability": "not_applicable", "impact": "LOW"},
    {"category": "access_control", "applicability": "not_applicable", "impact": "LOW"},
    {"category": "migration_rollback", "applicability": "not_applicable", "impact": "LOW"},
    {"category": "dependency", "applicability": "not_applicable", "impact": "LOW"},
    {"category": "operability", "applicability": "applicable", "impact": "LOW"}
  ],
  "success_criteria": ["Unknown metadata phase dependencies fail deterministically."]
}
