{
  "schema_version": "1.0.0",
  "plan_path": "plans/examples/refactor-plan.md",
  "goal": "Consolidate repeated installer path construction while preserving install and uninstall behavior.",
  "complexity_tier": "SMALL",
  "phases": [{"id": "1", "objective": "Exercise install and uninstall, then consolidate a proven repeated path expression.", "dependencies": [], "files": ["scripts/install.ps1", "tests/run-contract-tests.ps1"], "commands": ["powershell -ExecutionPolicy Bypass -File tests\\run-contract-tests.ps1"], "success_criteria": ["Install and uninstall smoke tests preserve their current output and files."]}],
  "semantic_risks": [
    {"category": "data_volume", "applicability": "not_applicable", "impact": "LOW"},
    {"category": "performance", "applicability": "not_applicable", "impact": "LOW"},
    {"category": "concurrency", "applicability": "not_applicable", "impact": "LOW"},
    {"category": "access_control", "applicability": "applicable", "impact": "LOW"},
    {"category": "migration_rollback", "applicability": "applicable", "impact": "LOW"},
    {"category": "dependency", "applicability": "not_applicable", "impact": "LOW"},
    {"category": "operability", "applicability": "applicable", "impact": "MEDIUM"}
  ],
  "success_criteria": ["Install and uninstall smoke tests preserve their current output and files."]
}
