{
  "schema_version": "1.0.0",
  "plan_path": "plans/revision-loop-plan.md",
  "goal": "Revise one focused acceptance assertion after a non-approved verification verdict.",
  "complexity_tier": "SMALL",
  "phases": [
    {
      "id": "1",
      "objective": "Add the missing focused acceptance assertion in the stated test file.",
      "dependencies": [],
      "files": ["tests/revision-request.tests.ps1"],
      "commands": ["powershell -ExecutionPolicy Bypass -File tests\\revision-request.tests.ps1"],
      "success_criteria": ["The focused acceptance assertion covers the requested revision."]
    }
  ],
  "semantic_risks": [
    { "category": "data_volume", "applicability": "not_applicable", "impact": "LOW" },
    { "category": "performance", "applicability": "not_applicable", "impact": "LOW" },
    { "category": "concurrency", "applicability": "not_applicable", "impact": "LOW" },
    { "category": "access_control", "applicability": "not_applicable", "impact": "LOW" },
    { "category": "migration_rollback", "applicability": "not_applicable", "impact": "LOW" },
    { "category": "dependency", "applicability": "not_applicable", "impact": "LOW" },
    { "category": "operability", "applicability": "applicable", "impact": "LOW" }
  ],
  "success_criteria": ["The focused acceptance assertion covers the requested revision."]
}
