{
  "schema_version": "1.0.0",
  "plan_path": "plans/score-plan-plan.md",
  "goal": "Give ControlFlow a deterministic score-plan command that turns the existing plan, sidecar, and verdict contracts into reproducible aggregate metrics. The scorer supplements, rather than replaces, the verifier's adversarial rubric and native Codex execution decisions.",
  "complexity_tier": "MEDIUM",
  "phases": [
    {"id": "1", "objective": "Define the public JSON output and prove the scorer is initially absent.", "dependencies": [], "files": ["tests/score-plan.tests.ps1", "tests/run-contract-tests.ps1"], "commands": ["powershell -ExecutionPolicy Bypass -File tests\\score-plan.tests.ps1"], "success_criteria": ["The initial test fails because scripts/score-plan.ps1 does not exist."]},
    {"id": "2", "objective": "Implement the six metrics, aggregate score, diagnostic issues, and deterministic verdict.", "dependencies": ["1"], "files": ["scripts/score-plan.ps1", "tests/score-plan.tests.ps1"], "commands": ["pwsh -NoProfile -File tests\\score-plan.tests.ps1"], "success_criteria": ["The bugfix golden plan scores 100 and returns APPROVED."]},
    {"id": "3", "objective": "Make scoring discoverable in the planner, verifier, README, and contract suite.", "dependencies": ["2"], "files": ["skills/controlflow-plan/SKILL.md", "skills/controlflow-verify/SKILL.md", "README.md"], "commands": ["powershell -ExecutionPolicy Bypass -File tests\\controlflow-skill-contract.tests.ps1"], "success_criteria": ["Documentation names score-plan and all six metrics."]},
    {"id": "4", "objective": "Prove the score-plan contract is portable, scoped, and consistent with the approved goal.", "dependencies": ["1", "2", "3"], "files": ["plans/artifacts/score-plan/verify-verdict.md", "plans/score-plan-plan.md"], "commands": ["powershell -ExecutionPolicy Bypass -File tests\\run-contract-tests.ps1 -UsePester", "git diff --check"], "success_criteria": ["All tests pass with VALID ControlFlow contract suite."]}
  ],
  "semantic_risks": [
    {"category": "data_volume", "applicability": "not_applicable", "impact": "LOW"},
    {"category": "performance", "applicability": "applicable", "impact": "LOW"},
    {"category": "concurrency", "applicability": "not_applicable", "impact": "LOW"},
    {"category": "access_control", "applicability": "not_applicable", "impact": "LOW"},
    {"category": "migration_rollback", "applicability": "not_applicable", "impact": "LOW"},
    {"category": "dependency", "applicability": "not_applicable", "impact": "LOW"},
    {"category": "operability", "applicability": "applicable", "impact": "MEDIUM"}
  ],
  "success_criteria": [
    "scripts/score-plan.ps1 emits one parseable JSON object with six named metrics, aggregate score, deterministic verdict, and diagnostic issues.",
    "A valid golden plan scores 100 and APPROVED; an unknown dependency scores zero on dependency_sanity and is not approved.",
    "The scorer never executes declared plan commands and adds no dependencies or plugin runtime.",
    "Windows PowerShell/Pester and PowerShell 7 full suites pass."
  ]
}
