{
  "schema_version": "1.0.0",
  "plan_path": "plans/examples/feature-plan.md",
  "goal": "Require a structured sidecar when ControlFlow creates a non-trivial durable plan.",
  "complexity_tier": "MEDIUM",
  "phases": [{"id": "1", "objective": "Describe Markdown and sidecar outputs in the planning skill and verify their paths.", "dependencies": [], "files": ["skills/controlflow-plan/SKILL.md", "tests/controlflow-skill-contract.tests.ps1"], "commands": ["powershell -ExecutionPolicy Bypass -File tests\\controlflow-skill-contract.tests.ps1"], "success_criteria": ["The planner skill documents both artifacts without owning native execution."]}],
  "semantic_risks": [
    {"category": "data_volume", "applicability": "not_applicable", "impact": "LOW"},
    {"category": "performance", "applicability": "not_applicable", "impact": "LOW"},
    {"category": "concurrency", "applicability": "not_applicable", "impact": "LOW"},
    {"category": "access_control", "applicability": "not_applicable", "impact": "LOW"},
    {"category": "migration_rollback", "applicability": "applicable", "impact": "LOW"},
    {"category": "dependency", "applicability": "not_applicable", "impact": "LOW"},
    {"category": "operability", "applicability": "applicable", "impact": "MEDIUM"}
  ],
  "success_criteria": ["The planner skill documents both artifacts without owning native execution."]
}
